{
  "contract_version": "ten-quantity-submission-v3",
  "message_type": "ten_quantity_submission",
  "message_id": "71111111-1111-4111-8111-111111111111",
  "correlation_id": "71111111-1111-4111-8111-111111111111",
  "causation_id": null,
  "idempotency_key": "mine-qy-001.2026-07.ten.r1",
  "revision": 1,
  "predecessor": null,
  "created_at": "2026-08-01T00:05:00Z",
  "sender": {
    "system_id": "agent-mine-qy-001",
    "party_id": "operator-qy-001",
    "role": "enterprise_agent"
  },
  "recipient": {
    "system_id": "mineguard-qinyuan",
    "party_id": "regulator-qinyuan",
    "role": "regulatory_platform"
  },
  "mine_id": "MINE-QY-001",
  "payload": {
    "mine": {
      "mine_id": "MINE-QY-001",
      "mine_name": "示例一号煤矿",
      "operator_id": "operator-qy-001",
      "operator_name": "示例一号煤业有限公司"
    },
    "timezone": "Asia/Shanghai",
    "period_start": "2026-07-31T23:30:00+08:00",
    "period_end": "2026-07-31T23:30:00+08:00",
    "closed_at": "2026-08-01T00:00:00Z",
    "comparison_context": {
      "capacity_band": "large",
      "mining_method": "underground-longwall",
      "shift_system": "three-shift-eight-hour",
      "coal_type": "bituminous",
      "operating_regime": "normal-production"
    },
    "days": [
      {
        "date": "2026-07-31T23:30:00+08:00",
        "operating_state": "producing",
        "reported_quantity": {
          "daily_total": {
            "ventilation_m3_min": {"metric_code": "ventilation_m3_min", "value": 8120.5, "unit": "m3/min", "aggregation": "time_weighted_average", "quality_flags": ["reported"], "source_refs": ["SRC-DIRECT-03"]},
            "electricity_kwh": {"metric_code": "electricity_kwh", "value": 125400, "unit": "kWh", "aggregation": "sum", "quality_flags": ["reported"], "source_refs": ["SRC-DIRECT-03"]},
            "detonators_count": {"metric_code": "detonators_count", "value": 48, "unit": "count", "aggregation": "sum", "quality_flags": ["reported"], "source_refs": ["SRC-MANUAL-03"]},
            "explosives_kg": {"metric_code": "explosives_kg", "value": 19.2, "unit": "kg", "aggregation": "sum", "quality_flags": ["reported"], "source_refs": ["SRC-MANUAL-03"]},
            "mine_entry_persons": {"metric_code": "mine_entry_persons", "value": 236, "unit": "person", "aggregation": "sum", "quality_flags": ["reported"], "source_refs": ["SRC-MANUAL-03"]},
            "production_t": {"metric_code": "production_t", "value": 3280.5, "unit": "t", "aggregation": "sum", "quality_flags": ["reported"], "source_refs": ["SRC-DIRECT-03"]},
            "extraction_t": {"metric_code": "extraction_t", "value": 3325.5, "unit": "t", "aggregation": "sum", "quality_flags": ["reported"], "source_refs": ["SRC-DIRECT-03"]},
            "sales_t": {"metric_code": "sales_t", "value": 2510.0, "unit": "t", "aggregation": "sum", "quality_flags": ["reported"], "source_refs": ["SRC-MANUAL-03"]},
            "transport_t": {"metric_code": "transport_t", "value": 2488.0, "unit": "t", "aggregation": "sum", "quality_flags": ["reported"], "source_refs": ["SRC-MANUAL-03"]},
            "wash_feed_t": {"metric_code": "wash_feed_t", "value": 3015.0, "unit": "t", "aggregation": "sum", "quality_flags": ["reported"], "source_refs": ["SRC-DIRECT-03"]},
            "invoiced_quantity_t": {"metric_code": "invoiced_quantity_t", "value": 2440.0, "unit": "t", "aggregation": "sum", "quality_flags": ["reported"], "source_refs": ["SRC-MANUAL-03"]}
          },
          "shifts": {
            "zero_shift": {
              "shift_code": "SHIFT-1",
              "start_at": "2026-07-30T16:00:00Z",
              "end_at": "2026-07-31T00:00:00Z",
              "measurements": {
                "ventilation_m3_min": {"metric_code": "ventilation_m3_min", "value": 8050.0, "unit": "m3/min", "aggregation": "time_weighted_average", "quality_flags": ["reported"], "source_refs": ["SRC-DIRECT-03"]},
                "electricity_kwh": {"metric_code": "electricity_kwh", "value": 41000, "unit": "kWh", "aggregation": "sum", "quality_flags": ["reported"], "source_refs": ["SRC-DIRECT-03"]},
                "detonators_count": {"metric_code": "detonators_count", "value": 16, "unit": "count", "aggregation": "sum", "quality_flags": ["reported"], "source_refs": ["SRC-MANUAL-03"]},
                "explosives_kg": {"metric_code": "explosives_kg", "value": 6.4, "unit": "kg", "aggregation": "sum", "quality_flags": ["reported"], "source_refs": ["SRC-MANUAL-03"]},
                "mine_entry_persons": {"metric_code": "mine_entry_persons", "value": 80, "unit": "person", "aggregation": "sum", "quality_flags": ["reported"], "source_refs": ["SRC-MANUAL-03"]},
                "production_t": {"metric_code": "production_t", "value": 1090.0, "unit": "t", "aggregation": "sum", "quality_flags": ["reported"], "source_refs": ["SRC-DIRECT-03"]},
                "extraction_t": {"metric_code": "extraction_t", "value": 1105.0, "unit": "t", "aggregation": "sum", "quality_flags": ["reported"], "source_refs": ["SRC-DIRECT-03"]},
                "sales_t": {"metric_code": "sales_t", "value": 820.0, "unit": "t", "aggregation": "sum", "quality_flags": ["reported"], "source_refs": ["SRC-MANUAL-03"]},
                "transport_t": {"metric_code": "transport_t", "value": 812.0, "unit": "t", "aggregation": "sum", "quality_flags": ["reported"], "source_refs": ["SRC-MANUAL-03"]},
                "wash_feed_t": {"metric_code": "wash_feed_t", "value": 1000.0, "unit": "t", "aggregation": "sum", "quality_flags": ["reported"], "source_refs": ["SRC-DIRECT-03"]},
                "invoiced_quantity_t": {"metric_code": "invoiced_quantity_t", "value": 800.0, "unit": "t", "aggregation": "sum", "quality_flags": ["reported"], "source_refs": ["SRC-MANUAL-03"]}
              }
            },
            "eight_shift": {
              "shift_code": "SHIFT-2",
              "start_at": "2026-07-31T00:00:00Z",
              "end_at": "2026-07-31T08:00:00Z",
              "measurements": {
                "ventilation_m3_min": {"metric_code": "ventilation_m3_min", "value": 8191.0, "unit": "m3/min", "aggregation": "time_weighted_average", "quality_flags": ["reported"], "source_refs": ["SRC-DIRECT-03"]},
                "electricity_kwh": {"metric_code": "electricity_kwh", "value": 42100, "unit": "kWh", "aggregation": "sum", "quality_flags": ["reported"], "source_refs": ["SRC-DIRECT-03"]},
                "detonators_count": {"metric_code": "detonators_count", "value": 16, "unit": "count", "aggregation": "sum", "quality_flags": ["reported"], "source_refs": ["SRC-MANUAL-03"]},
                "explosives_kg": {"metric_code": "explosives_kg", "value": 6.4, "unit": "kg", "aggregation": "sum", "quality_flags": ["reported"], "source_refs": ["SRC-MANUAL-03"]},
                "mine_entry_persons": {"metric_code": "mine_entry_persons", "value": 79, "unit": "person", "aggregation": "sum", "quality_flags": ["reported"], "source_refs": ["SRC-MANUAL-03"]},
                "production_t": {"metric_code": "production_t", "value": 1110.5, "unit": "t", "aggregation": "sum", "quality_flags": ["reported"], "source_refs": ["SRC-DIRECT-03"]},
                "extraction_t": {"metric_code": "extraction_t", "value": 1125.5, "unit": "t", "aggregation": "sum", "quality_flags": ["reported"], "source_refs": ["SRC-DIRECT-03"]}
              }
            },
            "four_shift": {
              "shift_code": "SHIFT-3",
              "start_at": "2026-07-31T08:00:00Z",
              "end_at": "2026-07-31T16:00:00Z",
              "measurements": {
                "ventilation_m3_min": {"metric_code": "ventilation_m3_min", "value": 8120.5, "unit": "m3/min", "aggregation": "time_weighted_average", "quality_flags": ["reported"], "source_refs": ["SRC-DIRECT-03"]},
                "electricity_kwh": {"metric_code": "electricity_kwh", "value": 42300, "unit": "kWh", "aggregation": "sum", "quality_flags": ["reported"], "source_refs": ["SRC-DIRECT-03"]},
                "detonators_count": {"metric_code": "detonators_count", "value": 16, "unit": "count", "aggregation": "sum", "quality_flags": ["reported"], "source_refs": ["SRC-MANUAL-03"]},
                "explosives_kg": {"metric_code": "explosives_kg", "value": 6.4, "unit": "kg", "aggregation": "sum", "quality_flags": ["reported"], "source_refs": ["SRC-MANUAL-03"]},
                "mine_entry_persons": {"metric_code": "mine_entry_persons", "value": 77, "unit": "person", "aggregation": "sum", "quality_flags": ["reported"], "source_refs": ["SRC-MANUAL-03"]},
                "production_t": {"metric_code": "production_t", "value": 1080.0, "unit": "t", "aggregation": "sum", "quality_flags": ["reported"], "source_refs": ["SRC-DIRECT-03"]},
                "extraction_t": {"metric_code": "extraction_t", "value": 1095.0, "unit": "t", "aggregation": "sum", "quality_flags": ["reported"], "source_refs": ["SRC-DIRECT-03"]},
                "sales_t": {"metric_code": "sales_t", "value": null, "unit": "t", "aggregation": "sum", "quality_flags": ["not_applicable"], "source_refs": ["SRC-MANUAL-03"]},
                "transport_t": {"metric_code": "transport_t", "value": null, "unit": "t", "aggregation": "sum", "quality_flags": ["not_applicable"], "source_refs": ["SRC-MANUAL-03"]},
                "wash_feed_t": {"metric_code": "wash_feed_t", "value": null, "unit": "t", "aggregation": "sum", "quality_flags": ["not_applicable"], "source_refs": ["SRC-DIRECT-03"]},
                "invoiced_quantity_t": {"metric_code": "invoiced_quantity_t", "value": null, "unit": "t", "aggregation": "sum", "quality_flags": ["not_applicable"], "source_refs": ["SRC-MANUAL-03"]}
              }
            }
          }
        }
      }
    ],
    "sources": [
      {
        "source_id": "SRC-DIRECT-03",
        "acquisition_mode": "direct_collection",
        "source_system": "mine-production-and-metering-gateway",
        "source_record_id": "2026-07-31",
        "source_location": "enterprise://gateway/2026-07-31",
        "captured_at": "2026-07-31T16:20:00Z",